{
  "schema": 1,
  "profile": "connectiq-runtime-v1",
  "id": "kaito-fixture-1",
  "revision": 7,
  "name": "KAITO FULL FIXTURE",
  "stepCount": 4,
  "steps": [
    {
      "key": "warm",
      "name": "WARM UP",
      "role": "warmup",
      "end": { "type": "time", "seconds": 600 },
      "target": { "type": "none" },
      "instruction": "RUN EASY"
    },
    {
      "key": "series~r1/work",
      "name": "WORK",
      "role": "work",
      "end": { "type": "distance", "meters": 1000 },
      "target": { "type": "pace", "fastSecPerKm": 240, "slowSecPerKm": 250 }
    },
    {
      "key": "series~r1/recovery",
      "name": "RECOVERY",
      "role": "recovery",
      "end": { "type": "time", "seconds": 120 },
      "target": { "type": "hr", "min": 120, "max": 140 }
    },
    {
      "key": "cool",
      "name": "COOL DOWN",
      "role": "cooldown",
      "end": { "type": "distance", "meters": 800 },
      "target": { "type": "none" }
    }
  ]
}
